id,Title,SKU,Condition,StockStatus,Description,LastUpdated,Price,TotalPriceReduction,Reason,HREF
136,ToolkitRC M8P Multifunctional Charger,bb-029167,Defective,N/A,"Discover the potential of the ToolkitRC M8P Multifunctional Charger, a versatile gem tucked away in our bargain bin. Although this unit has a defect and won't balance charge or calibrate, it's far ...",2024-04-04 09:58:13,10.0,,New Product,https://www.unmannedtechshop.co.uk/product/toolkitrc-m8p-multifunctional-charger-defective/
137,Betafpv LiteRadio 2 SE FrSky,bb-940572,Defective,N/A,"Dive into the world of RC with a project piece that's perfect for enthusiasts and tinkerers alike! Our Betafpv LiteRadio 2 SE Radio Transmitter is labeled ""Defective"" due to its inability to bind, ...",2024-04-04 09:58:13,10.0,,New Product,https://www.unmannedtechshop.co.uk/product/betafpv-literadio-2-se-frsky-defective/
138,IFlight Commando 8 ELRS,bb-387504,Open-Box,N/A,"Discover the potential of the iFlight Commando 8 ELRS, an exceptional choice for drone enthusiasts seeking a reliable and responsive control solution. This open-box item is in pristine condition, ...",2024-04-04 09:58:13,75.0,,New Product,https://www.unmannedtechshop.co.uk/product/iflight-commando-8-elrs-open-box/
139,XT60 Female to XT30 Male Plug Converter Adapter 4 pack,UPM-6,New,N/A,"Elevate your power source compatibility with our pack of 4 XT60 Female to XT30 Male Plug Converters, now available in brand-new condition. Each adapter is meticulously crafted to seamlessly ...",2024-04-04 09:58:13,5.0,,New Product,https://www.unmannedtechshop.co.uk/product/xt60-female-to-xt30-male-plug-converter-adapter-4-pack-new/
140,RushFPV Cherry2 Antenna II 5.8G LHCP MMCX90,UPM-3,New,N/A,"Elevate your FPV experience with the RushFPV Cherry2 Antenna II, now available in our bargain bin in pristine, new condition. Returned by a customer due to polarization requirements, this antenna ...",2024-04-04 09:58:13,8.0,,New Product,https://www.unmannedtechshop.co.uk/product/rushfpv-cherry2-antenna-ii-5-8g-lhcp-mmcx90-new/
141,Tmotor P1604 3850KV Motors (pack of 4),UPM-4,New,N/A,"Elevate your drone's performance with the Tmotor P1604 3850KV Motors, now available in a pack of four and in pristine, new condition. These motors are the perfect match for enthusiasts looking to ...",2024-04-04 09:58:13,42.0,,New Product,https://www.unmannedtechshop.co.uk/product/tmotor-p1604-3850kv-motors-pack-of-4-new/
142,DOGCOM Battery Strap (250x15mm),bb-467295,,N/A,"Elevate your drone's performance with the DOGCOM Battery Strap, a brand-new addition to our bargain bin collection. Designed for reliability and durability, this essential accessory ensures your ...",2024-04-04 09:58:13,2.0,,New Product,https://www.unmannedtechshop.co.uk/product/dogcom-battery-strap-new/
143,Fan for Micro RF TX Module (Transparent),bb-536029,New,N/A,"Elevate your Micro RF TX Module's performance with our sleek, new Transparent Fan – a perfect blend of functionality and style. This brand-new accessory is designed to ensure your module operates ...",2024-04-04 09:58:13,2.0,,New Product,https://www.unmannedtechshop.co.uk/product/fan-for-micro-rf-tx-module-transparent-new/
144,433mhz MAV Link Telemetry Kit,bb-842796,Defective,N/A,"Introducing our 433MHz MAV Link Telemetry Kit, now available at an unbeatable price in our Bargain Bin section. Please note that this specific unit is being sold in a defective condition. ...",2024-04-04 09:58:13,5.0,,New Product,https://www.unmannedtechshop.co.uk/product/433mhz-mav-link-telemetry-kit-defective/
145,BetaFpv BEC Board for Gopro 6/7,bb-315742,Defective,N/A,"Introducing the BetaFpv BEC Board for Gopro 6/7 , a hidden gem for DIY enthusiasts and tech-savvy individuals. Please note that this product is being sold in a  condition, meaning it may have some ...",2024-04-04 09:58:13,5.0,,New Product,https://www.unmannedtechshop.co.uk/product/betafpv-bec-board-for-gopro-6-7-defective/
146,HQ prop lipo battery straps (2x pack),bb-392605,New,N/A,"Introducing the HQ Prop Lipo Battery Straps (2x pack) , the perfect accessory to keep your drone batteries securely in place during flight. These straps are in pristine condition and are ready to ...",2024-04-04 09:58:13,2.75,,New Product,https://www.unmannedtechshop.co.uk/product/hq-prop-lipo-battery-straps-2x-pack-new/
147,Emlid Reach RS+ RTK Base,bb-218753,Defective,N/A,"Introducing the Emlid Reach RS+ RTK Base , a bargain bin product that is being sold in a  condition. Please note that this item is intended for spares and repairs only, as it has a battery fault. ...",2024-04-04 09:58:13,45.0,,New Product,https://www.unmannedtechshop.co.uk/product/emlid-reach-rs-rtk-base-defective/
148,Diatone Black Canvas Bag,E3C-836-EA5,,N/A,"This is a black canvas bag from Diatone that measures 27x38cm. Be honest with yourself, this is what is missing in your life...",2024-04-04 09:58:13,0.5,,New Product,https://www.unmannedtechshop.co.uk/product/diatone-black-canvas-bag/
149,FlySky FS-i6X Transmitter with FlySky Compatible Receiver,POA2257634,,N/A,"This is a used FS-i6X that has a strange right gimbal feel where it is sticky when moved all the way to the right edge.  Sold at a discount if you are happy to live with it as is, or happy to ...",2024-04-04 09:58:13,59.95,,New Product,https://www.unmannedtechshop.co.uk/product/flysky-fs-i6x-transmitter/
